{
  "remoteConfigProvider": "",
  "remoteConfigEndpoint": "",
  "remoteConfigPath": "",
  "remoteConfigSecretKeyring": "",
  "enabled": true,
  "log": {
    "format": "JSON",
    "level": "DEBUG",
    "network": "",
    "address": ""
  },
  "monitoring": {
    "address": ":8072",
    "timeout": 60
  },
  "public": {
    "address": ":8071",
    "timeout": 60
  },
  "ipify": {
    "address": "https://test.ipify.url.invalid",
    "timeout": 1
  }
}
